{
  "name": "Beam-TV",
  "description": "Open-source USB and DLNA media player for Samsung Tizen TVs — subtitles, resume playback, remote navigation, and a local companion server.",
  "repo": "TAGISWILD/beam-tv",
  "source": "release",
  "branch": "main",
  "assets": [
    { "match": "\\.wgt$", "output_name": "Beam-TV.wgt" }
  ]
}