{
  "name": "VexonTV",
  "description": "Live TV player for Samsung Tizen TVs: M3U, Xtream Codes and Stalker portals, provider EPG and a remote-first interface.",
  "repo": "DvzZDev/VexonTV",
  "repo_label": "VexonTV",
  "source": "build",
  "branch": "main",
  "skip_npm": true,
  "output_name": "VexonTV.wgt"
}
