{
  "name": "RÚV",
  "description": "Apps from RÚV, the Icelandic national broadcaster: Sarpur on demand, Barnaefni for children, Unglingar for teens, Menntun for education, and Útvarp radio.",
  "repo": "sverrirs/ruv-app-samsung",
  "repo_label": "sverrirs",
  "source": "release",
  "branch": "master",
  "assets": [
    { "match": "RUVVod.wgt", "output_name": "RUVVod.wgt" },
    { "match": "RUVKids.wgt", "output_name": "RUVKids.wgt" },
    { "match": "RUVUng.wgt", "output_name": "RUVUng.wgt" },
    { "match": "RUVMennta.wgt", "output_name": "RUVMennta.wgt" },
    { "match": "RUVUtvarp.wgt", "output_name": "RUVUtvarp.wgt" }
  ]
}
