{
  "name": "RÚV Live",
  "description": "Live TV from RÚV, the Icelandic national broadcaster: the RÚV and RÚV 2 channels, with the running schedule and rewind inside the live window (not affiliated with RÚV)",
  "repo": "sverrirs/ruv-live-samsung",
  "repo_label": "RÚV Live",
  "source": "release",
  "branch": "master",
  "assets": [
    { "match": "RUVLive.wgt", "output_name": "RUVLive.wgt" }
  ]
}
