{
  "name": "Reelo",
  "description": "TV client for the Reelo service: films and series with a remote-first interface, family profiles and library sync between devices (Russian UI).",
  "repo": "ihovsky/Reelo",
  "repo_label": "Reelo",
  "source": "direct",
  "url": "https://reelo.ru/samsung/reelo-latest.wgt",
  "output_name": "Reelo.wgt"
}
